id,is_relevant,target,source,action,action_type,location,date,country,year,news
18185,True,"['persons', 'Odisha Government officials', 'persons']","['Communist Party of India Maoist', 'CPI Maoist']",['abducted'],['Kidnapping'],"['Chitrakonda', 'Malkangiri']",['January 13'],india,2017,The Communist Party of India Maoist CPI Maoist cadres abducted five persons including four Odisha Government officials from Chitrakonda in Malkangiri District on January 13 reports The Times of India Odisha is going to have panchayat village level local self government institution elections on February 13 15 17 19 21 2017 Sources said a group of Maoists produced them at a ‘Praja Court’ people s court at Similipodar village The five persons have been identified as poll officials Hrushiskesh Naik and Purshottam Behra junior engineers Praveen Soren and Kamini Kanth as well as Jodamba village head Lakshaman Sisa s son Manoranjan Sisa sources said However another officer Lingaraj Majhi managed to escape
20458,False,,,,,,,india,2017,Meanwhile Police seized a powerful 25 kilograms Improvised Explosive Device IED which was packed in a big steel container was unearthed near a culvert on the Dornapal Jagargunda road suspected to have been planted by CPI Maoist cadres in Sukma District on June 20 reports Telangana Today Superintendent of Police SP Abhishek Meena said the explosive was immediately diffused by the bomb disposal squad he said Earlier an 8 kilograms IED was found in Kanker District on June 15 and a 5 kilograms bomb on June 11 According to the Police the 56 kilometres long stretch from Dornapal on NH 30 to Jagargunda is one of the most sensitive areas in Bastar division where the Naxalites Left Wing Extremists LWEs have executed several major attacks on Security Forces SFs in the past
24782,False,,,,,,,srilanka,2017,Northern Provincial Council has passed a resolution calling for the ratification of the Rome Statute so that Sri Lanka could be hauled up before the International Criminal Court ICC if crimes were committed in future reports Daily Mirror on March 18 Currently Sri Lanka is not a signatory to the Rome Statute and therefore anyone here could not be tried before the ICC In the resolution that was adopted the Northern Provincial Council resolves that the Government had not taken adequate measures to fully implement the Resolution 301 that it cosponsored at the United Nations Human Rights Council UNHRC Session in September 2015 especially with regard to the accountability establishment of a Commission for Truth Reconciliation non recurrence of oppression return of lands to its rightful civilian owners and an office of reparation
24987,False,,,,,,,srilanka,2017,Prime Minister Ranil Wickremesinghe addressing the ceremony to distribute title deeds organized by the Hill Country New Villages and Community Development Ministry under the theme Our house in our land at Hatton Dunbar Grounds said that Government is committed to solve ethnic issue reports Daily News on November 7 With regard to the ethnic issue Premier Wickremesinghe said the war is over and the people elected Maithripala Sirisena as the President in January 2015 with a mandate to rebuild the country But there is no development without peace We as Sri Lankans have to unite as one The Tamil National Alliance TNA have come forward for peace building for the first time They wanted a political solution for their demands
23317,False,,,,,,,pakistan,2017,Around 41 banned outfits of Pakistan operate openly on Facebook Dawn reported on May 31 Activity of 41 sectarian terrorist anti state organisations is accessible to every user on the social network They exist in plain sight just one search and one click away from any of Pakistan’s 25 million Facebook users An investigation carried out by Dawn across the month of April 2017 has revealed that 41 of Pakistan’s 64 banned outfits are present on Facebook in the form of hundreds of pages groups and individual user profiles Their network both interconnected and public is a mix of Sunni and Shia sectarian or terror outfits global terror organisations operating in Pakistan and separatists in Balochistan and Sindh
19545,False,,,,,,,india,2017,Bihar ranked third among the ten states hit by Left Wing Extremists LWEs violence in 2016 according to the data available on the Union Ministry of Home Affairs UMHA website reports The Times of India on April 28 from Patna District Besides Bihar Andhra Pradesh Chhattisgarh Jharkhand Madhya Pradesh Maharashtra Odisha Telangana Uttar Pradesh and West Bengal are the other states affected by LWE The MHA figures say altogether 1048 incidents of LWE violence took place in these 10 states in 2016 Bihar was third with 129 incidents Chhattisgarh with 395 incidents was on top followed by Jharkhand 323
22003,False,,,,,,,india,2017,Police on October 23 said that they arrested two persons of border town of Teetwal in Srinagar and recovered ammunition from them “At about 1800 hours police while Naka Checking on NHW near N R Colony Bemina under Batamaloo police station apprehended two persons namely Shakoor Ahmad Ksokhar son of Sanyee Khee and Tanveer Ahmad Raja son of Abdul Rashid Raja residents of Teetwal Karnah Kupwara and recovered 400 live rounds of AK 47 from their possession” a Police spokesman said
19831,False,,,,,,,india,2017,The clashes between students and SFs also broke out at Pattan in Baramulla District and in Hajin town of Bandipora district At these places police used tear and pepper canisters against the students who were protesting against the State and demanding release of their detained peers
23284,False,,,,,,,pakistan,2017,As part of the ongoing reconciliation process 26 militants belonging to various militant groups surrendered their weapons to authorities in Khuzdar District of Balochistan on May 19 reports Dawn The militants surrendered at a ceremony organised at the Kalat Scouts campus in Khuzdar
17693,False,,,,,,,bangladesh,2017,Police on March 28 suspected one of the four slain militants in Sylhet District to be the top leader of NeoJama atul Mujahideen Bangladesh JMB Maynul Islam Musa reports New Age Assistant Inspector General M Moniruzzaman said “Our intelligence suggest one of them is top neoJMB leader Musa ” He however added forensic investigation was ordered to further confirm of his identity as his face was mutilated in the security encounter Musa was entrusted with the charge of leading the NeoJMB which staged the July 1 2016 attack in Dhaka’s Holey Artisan Restaurant
18665,False,,,,,,,india,2017,While the bandh shutdown in some Districts like Kohima Wokha and Tuensang was relaxed the indefinite ‘State wide bandh’ by different Tribal groups entered the fifth day in Dimapur District on February 17 reports The Assam Tribune However Nagaland Tribes Action Committee NTAC postponed the ‘public rally’ and ‘fast unto death’ stir in Kohima scheduled to be held on February 17 The decision was made in view of the appeal of Chief Minister CM TR Zeliang to give him two three more days to ensure smooth transition of office and in the larger interest of the State
24218,False,,,,,,,nepal,2017,Meanwhile Chief Election Commissioner CEC Ayodhee Prasad Yadav speaking in the face to face programme organized by Reporters Club Nepal in Kathmandu on May 10 said the second phase local election date slated for June 14 should not be changed reports The Himalayan Times He said “The government can bring the budget but it must be in accordance with the election code of conduct Election is a must for freeing the country of the transition and nobody should desist from the main task of having the election organized on the stipulated date ”
17562,False,,,,,,,bangladesh,2017,Rapid Action Battalion RAB personals arrested two suspected Harkat ul Jihad al Islami Bangladesh HuJI B militants along with jihadi books and explosives in Damurhuda upazila sub District of Chuadanga District on January 28 today reports Daily Star The arrested HUJI members were identified as Abdullah Al Mamun and Rakibul Islam
24756,False,,,,,,,srilanka,2017,Joint Opposition on March 2 warned that the separatist groupsarecapable of arming 15 000 terrorists within 48 hours reports Daily Mirror Separatist groups have gathered information regarding 11 000 rehabilitated and released Tamils and yet another 4 000 Tamils who did not surrender to the Army and have sufficient hidden arms and ammunition enabling them to create a group of terrorists within 48 hours the Joint Opposition warned
18352,False,,,,,,,india,2017,Two cadres of the People s Liberation Front of India PLFI Manish Dahenga alias Rejan Dahenga and a minor boy were arrested on the outskirts of Khunti District on January 24 reports The Telegraph Police also seized INR 48 000 in cash and seven mobile phones from the duo PLFI is a splinter group of the Communist Party of India Maoist CPI Maoist
22773,False,,,,,,,india,2017,Separately Union Home Minister Rajnath Singh during a meeting with Members of Parliament MPs stated that boundary of Assam will not be compromised for ‘Nagalim’ reports Northeast Today on December 20 The Minister stated that ‘Not even a single inch of Assam will be incorporated in Nagalim Even Nagas will be evacuated if they encroach upon any area in Assam’
23652,False,,,,,,,pakistan,2017,three suspected criminals including two gangsters were arrested by Police during an operation in Sher Shah area of Karachi the provincial capital of Sindh on October 30 reports Pakistan Today The arrested gangsters were identified as Bhoro and Krishan
18795,True,"['machines', 'JCB', 'road roller machine']","['Communist Party of India Maoist', 'CPI Maoist', 'Maoist']","['ablaze', 'fire']","['Facility/Infrastructure Attack', 'Facility/Infrastructure Attack']",['Koraput'],['February 27'],india,2017,The Communist Party of India Maoist CPI Maoist cadres set ablaze the machines used for road construction at Mankidi village under Podapadar Panchayat village level local self government institution in Koraput District on February 27 reports The Telegraph According to sources more than ten Maoist cadres stormed into a contractor’s camp and set a JCB and a road roller machine on fire
18509,False,,,,,,,india,2017,National Investigation Agency NIA special court in Punjab on February 7 issued proclamation notices against Jaish e Mohammed JeM chief Masood Azhar and three others in connection with the January 2016 Pathankot terror attack case reports Indian Express Apart from Azhar the notices were issued against Abdul Rauf Asghar Shahid Latif and Kashif Jan According to the agency’s chargesheet Azhar along with his brother Abdul Rauf Latif and Jan masterminded the Pathankot attack Latif and Jan were the key handlers of the four attackers and gave them directions all the way from their infiltration into India till the beginning of the attack The proclamation notice which has been issued under section 82 of Criminal Procedure Code will have to be published in newspapers including in Pakistan NIA sources said The agency had filed the chargesheet last December against Masood Azhar and the three others for plotting the terror strike that left seven Indian security personnel dead and 37 injured The chargesheet is part of documents used by India for advocating its case for imposing UN sanctions against Azhar
24746,False,,,,,,,srilanka,2017,Separately Tamil National Alliance TNA in Parliament on February 23 extended its fullest support to the Government in the process of formulating a new constitution while expressing party s dissatisfaction in the Government s lack of progress in resolving the Tamil people s issues reports Colombo Page Leader of the Opposition R Sampanthan moving an adjournment debate motion in Parliament said While we on our part will extend the maximum cooperation to the satisfactory conclusion of these processes and to the non recurrence of violence it is absolutely essential that these processes be taken forward in a genuine and purposeful manner to ensure permanent peace with justice and equality to all citizens It is fundamental that all extends the fullest cooperation to enable the successful conclusion of these processes ”
22982,False,,,,,,,pakistan,2017,Anotherhuman rights activist Civil Progressive Alliance Pakistan CPAP president Samar Abbas 40 has gone missing from the federal capital Islamabad on January 7 reports Dawn on January 11 Mr Abbas is an activist based in Karachi who belongs to various forums that have been raising their voice voicing against atrocities committed against minority groups in the country Earlier Social media activists Waqas Goraya and Asim Saeed disappeared from Lahore on January 4 Ahmed Raza Naseer went missing from Sheikhupura on January 7 while Salman Haider vanished from Islamabad’sBani Gala area on January 6 adds The Express Tribune
18987,False,,,,,,,india,2017,A 26 year old man identified as A Shaikh was detained in Khargone District of Madhya Pradesh by the Maharashtra Anti Terrorism Squad ATS in connection with a case related to Islamic State IS on March 14 reports Hindustan Times He is being brought to Mumbai for questioning a senior Police official said here According to Police Shaikh who has completed his M Tech was allegedly in constant touch with one of the accused in the case who was earlier arrested for his alleged links with the banned terror group “Shaikh has not been placed under arrest so far We are examining his role in the case ” the official said without elaborating further More details are awaited
18057,False,,,,,,,india,2017,at least 14 people were injured when Police resorted to force while dispersing a mob picketing Manipur Government offices in Senapati District headquarters on January 3 reports The Morung Express The incident occurred when about 300 people gathered and marched towards the barricades put up across the road leading to the Senapati District Administration Office before being stopped by security personnel Under the aegis of United Naga Council UNC the picketing of Manipur Government Offices in Naga Districts began from midnight of December 31
21132,False,,,,,,,india,2017,In the meantime normal life remained paralysed on August 10 in Pulwama District where three militants of Zakir Musa group were killed in an encounter by SFs The mobile service also remained suspended in the district for the second day on August 10 to prevent spread of rumors on social media The District Magistrate DM Pulwama had ordered closure of all educational institutions as precautionary measure Business and other activities were crippled and traffic was off the road in the district though there was no strike call from any organisation
24824,False,,,,,,,srilanka,2017,The Cabinet approved the Counter Terrorism Bill to be enacted in place of the Prevention of Terrorism Act PTA reports Daily Mirror on April 26 The Government had given an undertaking to replace the PTA and replace it with fresh legislation on countering terrorism in conformity with international standards This matter was also mentioned in the UNHRC resolution Meanwhile the European Union had also requested the government to act in this regard for the granting of the GSP plus facility Sources said the new legislation included a broad definition of terrorism
18945,False,,,,,,,india,2017,The authorities placed separatist Hurriyat Conference G leaders including Shabir Ahmad Shah Muhammad Ashraf Sehrai Ayaz Akbar Raja Mehrajudin Mohd Ashraf Laaya and Umer Adil Dar under house arrest following a strike called by them against the killing of civilian adds Daily Excelsior Security has also been intensified to prevent violence in Kashmir
20095,True,"['construction camp', 'vehicles']","['Communist Party of India Maoist', 'CPI Maoist']","['raided', 'ablaze', 'beaten', 'injured']","['Barricade Incident', 'Facility/Infrastructure Attack', 'Unarmed Assault', 'Unarmed Assault']",['Giridih'],['June 1'],india,2017,A group of more than 50 Communist Party of India Maoist CPI Maoist cadres raided the construction camp and set ablaze five vehicles used in road construction in Giridih District on June 1 reports Bihar Prabha Five persons including the owner of the vehicle were beaten up The injured were shifted to hospital
18227,False,,,,,,,india,2017,A joint team of District Police District Reserve Group DRG Special Task Force STF and IndoTibetan Border Police ITBP arrested five Communist Party of IndiaMaoist CPIMaoist cadres in Kondagaon District during an antiNaxal Left Wing Extremism LWE operation on January 17 reports Daily Pioneer The arrested Maoists were identified as Ramdhar Nag 28 Jaisingh Nag 27 Neeldhar Yadav 21 Sukman Kashyap 26 and Sahu Kashyap 25 They were active Janmilitia members and were involved in various crimes including spreading false information about encounter arranging meetings for ultras and others
22380,False,,,,,,,india,2017,Meanwhile the Director General DG of Central Reserve Police Force CRPF RR Bhatnagar on November 23 said that this year 2017 SFs have achieved major successes against militants which has led to improvement in security situation in Kashmir reports Daily Excelsior “The security situation is improving with the successful operations of the security forces and this is possible due to coordination between various security agencies” he stated “This year 195 militants were killed They include top commanders of JeM Jaish e Mohammad HM Hizb ul Mujahideen and LeT Lashkar e Toiba Security forces have achieved these major successes this year and will continue their operations against the militants” he said
24952,False,,,,,,,srilanka,2017,Meanwhile while commending the Sri Lanka’s current progress to ensure human rights and reconciliation UN High Commissioner for Human Rights Zeid alHussein during a meeting with President Maithripala Sirisena in New York said he will be more satisfied if this journey of Sri Lankan Government will be speeded up reports Daily Mirror on September 23 During the meeting President Sirisena pointed out if the Government would take sudden actions regarding these the extremist groups will take advantages He invited Prince Hussein to visit Sri Lanka to witness the progress it has been achieved
24204,False,,,,,,,nepal,2017,The All Tarai Mukti Morcha ATMM led by Ajay Yadav aka Ajit Singh has merged with the second largest party Communist Party of Nepal Unified Marxist Leninist CPN UML at a programme held at Lalapatti Village in Saptari District on May 1 reports Republica Ajit Singh including the entire rank and file of the party formally entered the CPN UML party Singh had been living an independent life after submitting arms to the Government two years ago
18547,False,,,,,,,india,2017,During a joint operation by the Army and the Police a major terrorist hideout was busted at Mislai Bonjwah area in Kishtwar District of Jammu and Kashmir J K on February 10 reports The Financial Express Security Forces SFs recovered a huge quantity of arms and ammunition from the location which included one AK 47 rifle with 450 rounds 224 Pika ammunitions one Under Barrel Grenade Launcher UBGL two UBGL ammunitions and one binocular
24618,False,,,,,,,nepal,2017,Separately the BDS of the Nepal Army deactivated an Improvised Explosive Device IED at Bus Park near Laldhunga Bazaar in Parshuram Municipality in Dadeldhura District on December 4 reports The Himalayan Times The left alliance had organised an election campaign at the incident site earlier on the same day
25015,False,,,,,,,srilanka,2017,Police on November 27 arrested two persons carrying swords on a motorcycle in Chavakachcheri town of Jaffna District reports Colombo Page Police believe they may have been carrying the swords with the intention to commit a crime The two suspects aged 21 and 22 years are to be produced before the Chavakachcheri Magistrate s Court
23944,False,,,,,,,nepal,2017,Minister for Water Supply and Sanitation Prem Bahadur Singh speaking at an interaction organized by Reporters Club Nepal in Kathmandu on January 20 said that Constitution will be amended in course of implementation reports Republica “Constitution implementation is today’s necessity it can be amended if any complexity arises in the process of implementation ’’ he said
18771,True,"['Commando Battalion for Resolute Action', 'CoBRA']","['Communist party of India Maoist', 'CPI Maoist']",['injured'],['Unknown'],['East Singhbhum'],['February 26'],india,2017,A 207th Commando Battalion for Resolute Action CoBRA jawan of West Bengal identified as Om Prakash 32 was seriously injured in an encounter with the Communist party of India Maoist CPI Maoist cadres at a hill near Basadera village under Ghatshila Police Station area in East Singhbhum District on February 26 reports The Telegraph
19648,True,"['JCB', 'machines', 'tractors']","['Communist Party of India Maoist', 'CPI Maoist', 'CPI Maoist']",['torched'],['Facility/Infrastructure Attack'],['Koraput'],['May 4'],india,2017,The Communist Party of India Maoist CPI Maoist cadres torched two JCB machines and two tractors being used for construction of roads under the Pradhan Mantri Gram Sadak Yojana PMGSY in Majhigumandi and Uparagumandi villages of Koraput District on May 4 reports The Indian Express The CPI Maoist cadres left behind posters warning against resumption of road construction in the area and asking villagers not to cooperate with the contractor
20542,False,,,,,,,india,2017,Meanwhile Union Home Minister Rajnath Singh on June 26 hoped that violence will end in Kashmir and peace and happiness will be restored in the Valley soon to pave the way for emergence of new dawn reports Daily Excelsior In a video message to the people of Jammu and Kashmir on Eid festival Rajnath said new Sun will rise in Kashmir which will bring peace and normalcy back to the Valley and happiness for people of the State He hoped for return of peace in the Valley which has been facing series of violent incidents including spurt in militant activities attacks on police personnel etc though the Government has taken various measures to maintain peace Conveying his Eid greetings the Union Home Minister said the festival will help in bringing peace and happiness in the Kashmir Valley Singh said he conveys his Eid greetings to all Kashmiri brothers sisters youth seniors and children from the bottom of his heart
20874,False,,,,,,,india,2017,Meanwhile the Deputy Inspector General DIG of Police Dantewada range Sundarraj P told reporters that IEDs planted randomly in forests pose a big challenge in the counter insurgency operations reports Firstpost on July 24 According to Police data nearly 22 security personnel sustained injuries in 31 IED blasts triggered by Naxals in the first six months this year in Bastar range Security Forces SFs recovered at least 170 IEDs of various natures like pressure IEDs pipe bombs in the same period from the region which comprises seven Districts Bastar Kanker Kondagaon Narayanpur Dantewada Sukma and Bijapur
20558,False,,,,,,,india,2017,Security Forces SFs on June 27 conducted search operations at several places in Srinagar to hunt a group of JaisheMohammed JeM militants who are in the city for past two weeks and five more militants who are locals and have shifted to city recently reports Daily Excelsior SFs for last two weeks are tracking the militants and on June 27 they conducted searches at five places in the city during which two persons were detained Police and Central Reserve Police Force CRPF conducted searches at Firodus Abad and Khadi Mill areas of Batamaloo and detained two persons during the searches According to sources a group of five JeM militants headed by their ‘commander’ Mateen Bhai is in Srinagar for two weeks and SFs are on alert to prevent them from carrying out an attack in the city
19303,False,,,,,,,india,2017,24 Karbi Anglong based tribal organizations have jointly called for a 36 hours Karbi Anglong and West Karbi Anglong District bandh shutdown starting from April 10 5 a m till April 11 5 p m reports Nagaland Post reports April 8 The bandh has been called in order to pressurize the Karbi Anglong Autonomous Council KAAC and Assam Government to enact the Representation of Peoples Act 2017 to make Representation of Peoples Act rules 2017 and prepare KAAC’s voters list on the basis of the new act The organizations have also demanded that the election to the KAAC should be on the basis of the new voters list which would be prepared by KAAC after amending the old Representation of Peoples Act The tribal organizations have also filed a PIL no 9 2017 in the Gauhati High Court against KAAC
23677,False,,,,,,,pakistan,2017,The Special Police Unit SPU arrested three members of a banned and defunct outfit while they were distributing pamphlets of their organisation at railway crossing near Firdous Chowk Peshawar in Khyber Pakhtunkhwa KP on November 4 reports The Nation The arrested militants were identified as Irfanullah son of Gul Meezan resident of Landi Kotal in Khyber Agency of FATA Yousaf son of Rahman resident of Khurasan camp Peshawar and Ikramullah son of Daud resident of Afghanistan
20416,False,,,,,,,india,2017,Exuding confidence that the State Government was capable of handling the prevailing situation in Kashmir valley Union Minister of State for Home Affairs Kiren Rijiju on June 18 ruled out direct intervention by the Union Government to tackle the present state of affairs in Jammu and Kashmir J K reports Daily Excelsior “The State Government is capable of handling the situation and input support will be given by the Central Government in this regard ” he said in Srinagar
