id,is_relevant,target,source,action,action_type,location,date,country,year,news
22240,False,,,,,,,india,2017,Five Communist Party of India Maoist CPI Maoist militia members of the Galikonda and Korukonda area committees of the CPI Maoist in Visakhapatnam Agency surrendered before the Superintendent of Police SP Rahul Dev Sharma in Visakhapatnam District on November 13 reports The Hindu The surrendered militia members were Gemeli Ramesh 18 Musiri Appalanaidu 20 and Musiri Ramakrishna 20 hailing from Nallabelli area in Koyyuru mandal administrative sub division of Galikonda area committee They allegedly extended logistics support to the Maoists put up Maoist posters and were involved in a few other offences They reportedly joined the outfit around three years ago The two others were Killo Bangru 28 and Gemeli Venkateswara Rao 29 hailing from Chintapalli mandal The duo was allegedly involved in the offences which include the killing of home guard Sheikh Valli by planting and triggering a landmine in the Andhra Odisha Border AOB area close to Ramaraopalem in Annavaram Police Station limits in Visakhapatnam Agency this year
19974,False,,,,,,,india,2017,Jammu and Kashmir J K Deputy Chief Minister Nirmal Kumar Singh on May 25 said a comprehensive plan has been framed to deal with militancy and violence in Kashmir and assured its positive outcome reports Daily Excelsior Dr Singh said in Srinagar that “A comprehensive plan has been prepared to deal with militancy and violence Its results should not be seen through one or two incidents It is a comprehensive plan and it’s results will be positive I am sure there will be peace and law and order in Jammu and Kashmir ” The Deputy Chief Minister also backed Major Gogoi for his action of tying a man to jeep in central Kashmir’s Budgam District on April 9 and said the matter should not be politicised
19534,False,,,,,,,india,2017,in a press release issued by the outfit s information and publicity secretary H Kamsonsaid that ZeliangrongUnited Front ZUF ‘chairman’ JenchuiKamei and ‘finance secretary’ Benjamin alias GaichampouPameiwere ‘expelled from the party for their anti party activities’ in accordance to a decision of the party s ‘central executive council’ adopted on April 5 this year 2017 reports E paoon April 27
23985,False,,,,,,,nepal,2017,Deputy Prime Minister DPM Bimalendra Nidhi accused the main opposition CPN UML Communist Party of Nepal Unified Marxist Leninist of sowing the seed of secession in the country reports The Himalayan Times on February 11 Nidhi charged that the CPN UML had influenced the Constitution promulgation process with a condition to make its party Chairman KP Sharma Oli to make the Prime Minister subsequently and now it was preventing the implementation of Constitution
18881,False,,,,,,,india,2017,Indian Army troopers recovered an Improvised Explosive Device IED from a paddy field of Dubluhabi area of Charaipung forest division in Charaidew District on March 5 reports The Sentinel Army arrested one suspected person identified as Ghanakanta Gogoi in this connection According to the Army the arrested person was secretly working for the Independent faction of United Liberation Front of Asom ULFA I
20840,False,,,,,,,india,2017,Meanwhile State Government has told the Union Ministry of Home Affairs UMHA that it will not recommend withdrawal of the Armed Forces Special Powers Act AFSPA of 1958 from a few areas at least till August 31 because of the possibility of subversive activities by the ULFA I reports Times of India on July 21
18462,False,,,,,,,india,2017,The Nainital Police issued warrants on February 3 against nine suspects in connection with inflammatory slogans written by suspected of the Communist Party of India Maoist CPI Maoist cadres on the walls of houses in a village of Nainital District on February 2 reports The Times of India Police have also announced a bounty of INR 10 000 on one of the suspects Kheench Singh Bora Police said Bora alias Vijay Nehru alias Prabhakar a resident of Someshwar in Almora District had been active in Naxal Left Wing Extremist LWE related activities in the State Nainital Senior Superintendent of Police SSP Janmejay Khanduri said Intense search and combing operations are going on All suspects are on our watch and we will soon locate people who were behind the incident
23571,False,,,,,,,pakistan,2017,Security Forces SFs on September 24 killed three militants in Gara Madda area of Dera Ismail Khan District in Khyber Pakhtunkhwa reports Dawn A press release issued by Inter Services Public Relations ISPR stated that the law enforcement agencies were carrying out a search operation in Gara Madda area when the alleged encounter took place The officials signalled three people riding a bike to stop but they reportedly resorted to firing on the SF personnel ensuing an encounter claimed ISPR All the three suspects were later identified as Iqbal Waheed and Majid said ISPR adding that Iqbal was reportedly carrying a head money of PKR one million
23805,False,,,,,,,pakistan,2017,Jamaat Ud Dawa JuD ‘chief’ Hafiz Saeed on December 8 led a rally to launch a countrywide campaign against United States US President Donald Trump’s recognition of Jerusalem as Israel’s capital outside the JuD headquarters in Chauburji in Lahore in Punjab reports Hindustan Times Saeed said the Pakistani Government should immediately convene a Joint Session of Parliament to discuss the issue Saeed said the Defence Council Pakistan DCP will send its delegations to Muslim countries and convince them not to open their embassies in Jerusalem
20135,False,,,,,,,india,2017,Hundreds of youth assembled in Nowhatta area in Srinagar after Friday prayers were over at historic Jama Masjid Unlike past occasions there was no deployment of SFs this Friday in Nowhatta and its adjoining areas Youth who assembled in main square of Nowhatta shouted slogans The youth later resorted to heavy stone throwing on SFs near Gunj Baksh Park in Nowhatta Although the security forces chased these stone throwers multiple times but the latter repeatedly re grouped and pelted stones heavily During clashes a youth was detained by Police The clashes later spilled over to Saraf Kadal and Rajouri Kadal localities
20153,False,,,,,,,india,2017,Further the entire Ri Bhoi District is under security cover following cases of arson reported from different places since last week reports The Shillong Times Ri Bhoi Superintendent of Police SP R P Singh on June 3 said that one more company of Central Reserve Police Force CRPF has been brought into the district and altogether two companies have been deployed in the district besides local Police force Violence erupted in the district after a group of KSU activists allegedly attacked the railway construction site in Byrnihat last week
23686,False,,,,,,,pakistan,2017,Security Forces SFs during the ongoing Operation Raad ul Fasaad Operation Elimination of Discord arrested three militants and recovered arms and ammunition from a car in the Darra Adam Khel town of Frontier Region Kohat in Federally Administered Tribal Areas FATA on November 6 reports The News The recoveries included Sub Machine Guns SMGs 30bore and 9 mm pistols 12 bore repeaters and rifles of different calibres along with thousands of ammunition
24082,False,,,,,,,nepal,2017,Democratic Madhesi Front UDMF cadres on March 15 vandalized sign boards installed at rural municipality offices as part of their protest against restructuring of local bodies in Rautahat District reports The Himalayan Times Rautahat has 16 local bodies including three municipalities and 13 rural municipalities as per the recent restructuring of local bodies UDMF cadres vandalized sign boards installed at most of the offices
21020,True,"['Danapur Durg Express train', 'CRPF', 'Commando Battalion for Resolute Action', 'CoBRA', 'CRPF', 'mobile tower']","['Communist party of India Maoist', 'CPI Maoist', 'CPI Maoist']","['hijacked', 'fire', 'blown']","['Hijacking', 'Armed Assault', 'Bombing/Explosion']",['Lakhisarai'],['August 3'],india,2017,Danapur Durg Express train was hijacked by the Communist party of India Maoist CPI Maoist cadres in the Lakhisarai District on August 3 today reports The Times of India A statement issued by the Central Reserve Police Force CRPF stated that an exchange of fire also took place between CPI Maoist cadres and 207 Commando Battalion for Resolute Action CoBRA of CRPF A mobile tower in the area was also blown up No casualties were reported from either side
23876,False,,,,,,,pakistan,2017,The Ministry of Interior has termed the Milli Muslim League MML an offshoot of proscribed entities including Jamaat ud Dawa JuD Falah i Insaniat Foundation FIF and Lashkar e Toiba LeT and opposed its registration as a political party with the Election Commission of Pakistan ECP reports Dawn on December 23 The Ministry in its written reply submitted to the Islamabad High Court IHC on a petition filed by MML seeking its registration with the ECP requested the Court not to consider MML’s plea and dismiss the petition accordingly It also mentioned that a Security Agency opined that “it is difficult to believe that MML will tread its own path completely at variance with its mother LeT and JuD organisations”
23945,False,,,,,,,nepal,2017,Major three political parties on January 21 agreed in principle on holding local level elections in the fourth week of April reports Republica The agreement was reached at a meeting of top leaders of Communist Party of NepalMaoist Centre CPNMaoist Center Nepali Congress NC and Communist Party of NepalUnified Marxist Leninist CPNUML called by Prime Minister Pushpa Kamal Dahal in a bid to create a favorable environment politically legally and in terms of security to organize the local level elections at the earliest The parties also agreed to take initiative to pass the bill related to local bodies which is under consideration at the Parliamentary Committee through short process
18701,False,,,,,,,india,2017,Seven Communist Party of IndiaMaoist CPIMaoist cadres surrendered to the Superintendent of Police SP Bharati Ghosh in West Midnapore District on February 20 reports PTI The seven had 48 cases pending against them The seven surrendered CPIMaoist cadres were Saheb Murmu alias Jayanta Saheb’s wife Manasi Mahato Dilip Singh Malati Singh wife of Dilip Samir Mahato Baidyanath Mahato and Banamali Mahato The surrendered CPIMaoist cadres deposited one AK47 rifle and seven country made guns to the Police The surrendered Maoists all residents of Jhargram SubDivision were allegedly involved in extortion attacks and other criminal cases in past few years
21283,False,,,,,,,india,2017,The Shillong Timesadds that the Security Forces SFs have been carrying out aggressive operations in the South Arunachal areas bordering Myanmar where Naga rebels belonging to all the factions of the NSCN including NSCN IM NSCN K and NSCN R are active creating nuisance for the people of the area
17533,False,,,,,,,bangladesh,2017,Police arrested six JeI activists from a house at Housenagar village in Chapainawabganj District when they were holding a clandestine meeting on January 11 reports The Daily Star Police recovered five crude bombs from them
18949,False,,,,,,,india,2017,About 200 Dongria Kondhs tribals of Niyamgiri Hills staged a demonstration in front of the Rayagada District Police Office on March 10 reports The New Indian Express Tribals were demanding release of Bari Pidikaka of Tahali village Dashuru Kadraka and Saiba Pushika of Gortha village who were arrested on charges of being Naxals Left Wing Extremists LWEs Ladda Sikaka convener of Niyamgiri Surakhya Samiti NSS said unable to fight the Maoists Police is targeting innocent Dongria Kondhs branding them as Maoist supporters They have threatened to stage mass protests from Rayagada to Bhubaneswar if their demands are not met
24724,False,,,,,,,srilanka,2017,Earlier Foreign Affairs Minister Mangala Samaraweera while meeting Colombo based foreign correspondents said that a new Constitution is the most potent weapon for non recurrence of Sri Lanka’s conflict and would have to be given priority over accountability mechanisms reports Daily Mirror The country which suffered two youth insurrections and a 26 year long war had seen enough violence and bigotry and needed checks and balances to ensure that the road ahead is peaceful he told Minister Samaraweera assured that the Government was committed to drafting a new Constitution that would pave the way for reconciliation
24967,False,,,,,,,srilanka,2017,A group of protesters including the Northern Provincial councilor K Shivajilingam held a discussion with President Maithripala Sirisena on October 19 at the Presidential Secretariat regarding the Tamil prisoners reports Colombo Page The group including councilor K Shivajilingam staged a protest demonstration carrying black flags when President Sirisena was visiting Jaffna on October 14 A small group of people demanding the transfer of three Tamil prisoners who have been sent from the Vavuniya Prison to the Anuradhapura Prison back to Vavuniya Prison staged a protest along the road waving black flags The President asked the demonstrators to visit Colombo and discuss any problems with him to find ways and means to settle them
21379,False,,,,,,,india,2017,Union Minister of Home Affairs UMHA Rajnath Singh will roll out details of the Central Government’s plan to combat Left Wing Extremism LWE before the Member of Parliaments MPs during the consultative committee meeting on August 29 today reports Indian Express According to UMHA 12 000 citizens died in LWE violence over the past two decades Of these 2 700 were security personnel and 9 300 were civilians Singh is likely to take up issues related to tribal rights and discuss security and development related measures
18245,False,,,,,,,india,2017,The National Investigation Agency NIA on January 17 arrested one IS Islamic State operative identified as Mohammed Irfan alias Abu Jafar a resident of Mir Alam Mandi in the old city of Hyderabad reports Hindustan Times He was produced before NIA special court which sent him to judicial custody for seven days According to the investigation agency he along with the other accused took part in searching of hideouts and physical training Irfan allegedly collected the explosive precursors along with another accused from the outskirts of Pochampally village of Nalgonda District in Telangana He also went to Ananthapur town of Andhra Pradesh to collect explosive material “Investigation has revealed that Irfan also took an oath of allegiance in favour of Abu Bakr Al Baghdadi the self proclaimed caliph of the IS in the presence of accused Mohammed Ibrahim Yazdani and Muzaffar Hussain Rizwan and he was given a kunya name Abu Jafar by Mohammed Ibrahim Yazdani ” said an NIA official
21581,False,,,,,,,india,2017,The bodies of the five militants suspected to be from the People’s Liberation Army PLA and Manipur Naga People’s Front MNPF at Makan village in Kamjong district have been retrieved and brought to Kasom Khullen in same District on September 13 reports Epao The five deceased were identified as ‘sergeant major’ Richard alias Wareppam Dinesh ‘ ‘sergeant’ Lalloi alias Khundrakpam Sunil ‘private’ Nanao alias Moirangthem Tomba ‘private’ Sinthouba alias Konjengbam Shyamsundar and MNPF cadre Raikham Jajo alias Nimai Jazo The five were gunned down by Nationalist Socialist Council of NagalandIsak Muivah NSCNIM cadres on September 12
17708,False,,,,,,,bangladesh,2017,Special Weapons and Tactics SWAT launched an operation codenamed ‘Operation Maximus’ at a militant den in Borohat area of Moulvibazar District on March 31 reports The Daily Star Counterterrorism officials said there might be four to five militants including a woman with a huge stash of explosives at the hideout One of them is probably an Afghan trained expert bomb maker who is known in terror circles as “Boro Bhai” Big Brother Whenever the special force tried to close in on the hideout the militants pushed them back by exploding bombs There are many rooms in the house and explosives are planted here are there making the operation complicated
18849,False,,,,,,,india,2017,A joint operation between the Army and the Special Operations Group SOG of Jammu and Kashmir J K Police was launched against militants on March 3 evening and the encounter is still March 4 underway in Chilli Pora village in Shopian District reports The Indian Express Officials said that troops of 55 Rashtriya Rifles RR and SOG of J K Police launched the operation after Security Forces SF received specific input about the militant presence in the village Officials said they had input that two to three militants had been hiding in the village
18041,True,"['civilian', 'Assam Rifles', 'AR', 'The Sangai Express Troops', 'AR', 'AR', 'AR']",['suspected militants'],"['killed', 'attacked', 'fire']","['Armed Assault', 'Armed Assault', 'Armed Assault']","['Kasom Khullen', 'Kamjong']",['January 2'],india,2017,One civilian identified as Athari Samson 54 and an Assam Rifles AR trooper identified as Bhupal Singh 42 were killed in an encounter with suspected militants at Khunthak village of Kasom Khullen sub division in Kamjong District on January 2 morning reports The Sangai Express Troops of 27 AR were going on foot for an operation when they were attacked by militants who opened indiscriminate fire at around 10 30 am The AR troops too retaliated The encounter left one AR trooper and another man dead
20872,False,,,,,,,india,2017,Mangru Portet 48 an ‘area committee member’ of Aheri Dalam armed squad of the Communist Party of India Maoist CPI Maoist was killed during an encounter with C 60 commandos in the forest of Kopewancha near Rajaram Khanla village under Aheri taluka administrative division in Gadchiroli District on July 23 reports The Times of India A press release issued by the Gadchiroli Police stated during a heavy exchange of fire the Police team gunned down one Naxalite Left Wing Extremist LWE identified as Mangru alias Ram Chinna Portet while others managed to flee the spot A 12 bore gun and some Naxal literature were also recovered from the spot said the release Portet engaged in the movement for more than two decades having more than 40 offences against him had a reward of INR 600 000 on his head Portet was shifted to Aheri a couple of years ago by the senior brass of rebels so that he can strengthen the base of the party in his home taluka Gadchiroli Deputy Inspector General of Police DIG Ankush Shinde said the Naxalites had gathered at the forest between Rajaram Khanla and Damrancha to hold a meeting It was their temporary camping site which was raided by the C 60 commandos following concrete information We feel that more Naxalites could be injured during the exchange of fire DIG Shinde added
24599,False,,,,,,,nepal,2017,Separately Chief District Officer of Saptari District Bhagirath Pandey on November 30 said security agencies had taken the Netra Bikram Chand led Communist Party of Nepal CPN as the biggest threat to security in the run up to the second phase of provincial and parliamentary elections scheduled for December 7 reports The Himalayan Times Pandey said although there was no security threat in the recently held local level elections and no clashes were reported security agencies were however alert to ensure security in the face of the CPN’s increased armed activities
24505,False,,,,,,,nepal,2017,Naya Shakti Party Nepal NSPN at the meeting of the party’s Provincial Secretariat in Kathmandu on October 13 decided to go it alone in the upcoming provincial and parliamentary elections and exited the left electoral alliance reports The Himalayan Times The party decided to contest the polls with its own symbol of the ‘eye’ In a statement issued after the meeting the party said it took the decision after alliance partners the Communist Party of Nepal Unified Marxist Leninist CPN UML and Communist Party of Nepal Maoist Centre CPN Maoist Centre decided against the agreement to contest the elections under a common symbol
22249,False,,,,,,,india,2017,Also the SFs in the evening of November 14 launched a search operation in the Ahmad Nagar area of Srinagar after reports of two local militants hiding there reports Daily Excelsior However the operation was later called off after no militants were found there
22661,False,,,,,,,india,2017,In a publication dated December 1 in their magazine Rumiyah the Islamic State IS has urged the Kashmiri Muslims to re initiate their jihad under the “banner of the Khalifah” and behead every Indian and Pakistani soldiers who confront them reports The Times of India on December 12 The ‘article’ also warned the audience not to be swayed away with lies by spies of Research and Analysis Wing RA W and Inter Service Intelligence ISI intelligence agencies of India and Pakistan respectively Even if their names resemble those of Muslims they are murtadd apostate and have left the religion of Allah just as the arrow leaves the bow so crush the heads of these wolves in sheep s clothing before these murtaddin a person who became apostate hit you said the post uploaded on SITE Intelligence Group website as reported in the news report Originally published in Urdu language the ‘article’ was translated by a Kashmiri centric pro IS media group ‘Al Qaraar’
24420,False,,,,,,,nepal,2017,Separately Rastriya Janata Party Nepal RJPN has decided not to take part in the third phase of local level elections to be held in Province 2 on September 18 reports The Himalayan Times on August 8 RJPN leader Manish Kumar Suman said “We have also decided to announce protest programmes to disrupt the third phase of local level elections if the government does not address our demands within a week ” The RJPN has been demanding passage of the constitution amendment bill withdrawal of false charges against its cadres compensation for kin of cadres who got killed or suffered injuries during protests martyrdom status for those killed and more local levels in Province 2
24649,False,,,,,,,nepal,2017,Separately CPN UML Chairman KP Sharma Oli on December 15 held a meeting with President Bidhya Devi Bhandari to discuss contemporary issues reports The Himalayan Times Oli’s meeting with the president came at a time when there are differences between the NC and CPN UML over the ordinance related to the election of the NA The Sher Bahadur Deuba led government has forwarded the ordinance to the President proposing single transferable vote system that gives opposition parties a chance to get their members elected to the upper house But the CPN UML is in favor of forming the Government first and the new Government would frame laws to govern the process of the National Assembly election
19621,False,,,,,,,india,2017,Also Chief Minister Mehbooba Mufti on May 3 appealed youth of Kashmir to help in progress and development of the State to save the place from destruction adds Daily Excelsior Mehbooba urged for ending the destruction loot and murder in Kashmir “I think there cannot be anything more unfortunate other than this I think we need to think what are we doing by this type of ransacking dacoity and murders and what are we doing for our nation this time What are we achieving from this destruction looting and murders Students are not being allowed to go to schools ” she said “Banks where poor people deposit their money are being looted ” she said
17619,False,,,,,,,bangladesh,2017,Police arrested five war crimes suspects at Batiyaghata in Khulna District on March 2 reports New Age The arrested were identified as Ashraf Sheikh Amjad Hossain Hawlader Atiar Sheikh Motachchhin Billah and Kamal Uddin Goldar Prosecutor Sabina Yasmin Khan Munni of the War Crimes Tribunal said the arrested five people were among the eight accused of a war crimes case in Khulna The five were the members of Razakar Bahini and they were involved in committing crimes against humanity at places in Batiyaghata during the Liberation War in1971 she added
23513,False,,,,,,,pakistan,2017,Further Foreign Office FO spokesperson Nafees Zakaria on September 5 said that Pakistan is seriously concerned about the threat posed by terrorism and extremism in the South Asian region reports Dawn Zakaria was speaking in reference to the BRICS leaders summit document which named militant groups allegedly based in Pakistan as a regional security concern Many terrorist groups based in the region — including in Afghanistan — such as the banned Tehreek i Taliban Pakistan and its associates like Jama’atul Ahrar JuA have been responsible for extreme acts of violence against Pakistani people Zakaria said We are deeply concerned at the presence of banned groups like Daesh East Turkestan Islamic Movement and Islamic Movement of Uzbekistan in the ungoverned spaces in Afghanistan as they pose a threat to peace and security in the region Zakaria further said that Pakistan is concerned about the rise of extremist ideologies and intolerance in the region which have been encouraging social stratification and systematic targeting of minorities
