id,is_relevant,target,source,action,action_type,location,date,country,year,news
22241,False,,,,,,,india,2017,Kashmiri youth visiting Pakistan are being imparted training in cybercommunication and used as conduits for conveying specific instructions a multiagency body constituted by the Government to probe terrorism and smuggling of drugs across the IndoPak border found reports The Times of India on November 13 Kashmiri youth who are either studying in Punjab or involved in some business there are being encouraged to visit Pakistan on valid visa documents said a report of the agency that has members from the Punjab Police Border Security Force BSF and the Army It was underlined that a particular pattern with the Kashmiri youth visiting Pakistan was observed from the data of 2016 The frequent overstaying of visa period by Kashmiri youth was pointed out and it was observed that the database and details of Indians who have either under stayed or over stayed the visa period should be closely monitored and shared with all the concerned agencies In one such case a resident of Kulgam in Jammu and Kashmir was found carrying specific instructions from Saifullah Ghazi a terrorist active in Rawalpindi the report recorded The youth was provided money to purchase a mobile phone and install BBM app in order to receive further instructions from his handlers in Pakistan which he was supposed to convey to his commander in Kulgam the report said The report expressed concern over the trend for it was done at the behest of JaisheMohammed JeM ‘chief’ Masood Azhar The role of Azhar’s younger brother Talha AlSaif has also come to light It might be mentioned here that a petition pertaining to drugs and cross border terrorism is pending adjudication in the Punjab and Haryana High Court The agency has learnt about the involvement of banned Pakistani terrorist outfit JamaatudDawa JuD which the report said has increased its training activities all across Pakistan administered Kashmir PaK and Pakistan occupied Kashmir PoK particularly after Eid Over the period of two months three to four reports of infiltration from Gurdaspur and Amritsar area have been received The Indian intelligence agencies were informed that JeM student wing AlMurabitun AM organised a second annual congregation for Jihadi indoctrination titled “Islamic and Training Convention” at Balakot KhyberPakhtunkhwa Province of Pakistan from July 28 to 30 which was addressed by Talha AlSaif Besides JeM inducted a batch of 1213 students at Markaz UsmanoAli Bahawalpur from July 10 to 21 in which 70 students from Peshawar Manshera and Balakot in Khyber Pakhtunkhwa participated Another JeM centre in Karachi was scheduled to conduct a DauraeTarbiya course from July 21to 27
22897,True,,"['Communist Party of India Maoist', 'CPI Maoist']",['murder'],['Unknown'],['Baguria'],"['2007', '2009']",india,2017,Security Forces SFs arrested a Communist Party of India Maoist CPI Maoist ‘sub zonal commander’ identified as Rajendra Singh Munda 30 alias Gudru Munda alias Raju alias Chandan during a search operation in Aamda under MGM Police Station area in East Singhbhum District on December 26 reports The Times of India Munda is one of the accused in the murder of Sunil Mahto Lok Sabha MP from Jamshedpur at Baguria near Ghatshila in 2007 and wanted in the landmine blast near Burudih dam in Ghatshila that killed 14 Central Reserve Police Force CRPF personnel in 2009 He was involved in over six CPI Maoist related cases in Galudih and Bodam Police Station areas in the District The SFs recovered one country made loaded pistol of 7 65 bore five live cartridges of 0 5 bore four bundles of codex wires 25 piece detonators and 36 pieces of power gel from Munda said Anoop T Mathew Senior Superintendent of Police SSP
18753,False,,,,,,,india,2017,Stonethrowing clashes broke out in parts of summer capital Srinagar and in Sopore town of North Kashmir on February 24 after Friday prayers during which Police used teargas against stonethrowers reports Daily Excelsior Witnesses said soon after the culmination of Friday congregational prayers dozens of masked youth came out of Jama Masjid in Nowhatta and started sloganeering Amid sloganeering the masked youth pelted stones on Security Forces SFs deployed in the area and clashed with them for nearly an hour Later the clashes spilled over to nearby neighbourhoods and Police used dozens of teargas shells against the stonethrowers at Saraf Kadal and Rajouri Kadal localities The clashes continued for several hours
24258,False,,,,,,,nepal,2017,Three major Madhescentric political parties have initiated discussions to forge consensus in the upcoming second phase of local level polls reports The Himalayan Times on May 26 Leaders of Rastriya Janata Party Nepal RJPN Nepal Loktantrik Forum and Federal Socialist ForumNepal held discussions for their bid to forge consensus in the polls at RJPN leader Mahantha Thakur’s residence in Sanothimi Bhaktapur However the meeting ended inconclusively It has been learned that the leaders shared their opinions whether to take part in the polls or to take to the streets Among the RJPN leaders Thakur seemed positive towards polls while some others were reluctant to take part in the polls it has been learned
24980,False,,,,,,,srilanka,2017,Meanwhile Chairman of the Constitutional Assembly CA Speaker Karu Jayasuriya on November 1 announced that he had decided to extend the duration of the debate on interim report of the steering committee due to the demand from a large number of MPs for additional time to express their views reports Colombo Page The assembly had previously allocated three days October 30 31 and November 1 for the debate The Speaker has extended the time by one day and accordingly the CA continues the debate on November 2 as well Further at a later meeting with party leaders it was decided to continue the debate on Constitutional Assembly Steering Committee’s Interim Report till November 5 reports Asian Mirror
19282,False,,,,,,,india,2017,A woman identified as Naorem Lukamani Devi who was declared an absconder by Special Court National Investigation Agency NIA Guwahati on March 28 last year 2016 was arrested by the investigation agency from Takyel Khongbal Mayai Leikai in Imphal West District on April 5 reports The Sangai Express The husband of the arrested woman Priyokumar alias Kesho Meitei is the ‘commander in chief c in c ’ of the Kangleipak Communist Party Mobile Task Force KCP MTF who was arrested by NIA from Siliguri in West Bengal in June 2012
22893,False,,,,,,,india,2017,Meanwhile another Maoist cadre identified as Devsingh Padda alias Banderam 26 carrying a reward of INR 100 000 on his head surrendered before the Senior Police and Border Security Force BSF in Kanker District on December 26 reports PTI Padda who was head of Aaldand ‘Janatana Sarkar’ ‘people’s government’ unit under North Bastar division of CPI Maoist was tasked with arranging meeting of senior cadres putting up Maoist posters banner and pamphlets and gathering information added Police
21989,False,,,,,,,india,2017,Indian security agencies are looking for information about a doctor believed to be from of Kerala who recently featured into a propaganda video of Islamic State IS India Today reports on October 23 Abu Muqatil al Hindi who appears to be in his mid forties and speaks with a thick accent is seen exhorting medical professionals from across the world to join the healthcare services at the IS held zones of Syria in the name of Islamic brotherhood Agencies point out to another doctor in the same video named Abu Yusuf al Australi who turned out to be Dr Tareq Kamleh from Adelaide Australia who joined the terror outfit in 2015 We strongly suspect al Hindi to be at the helm of recruiting jihad sympathisers from India a top security official told Mail Today on condition of anonymity Shahjahan Velluva Kandy from Kannur Kerala who was deported from Turkey after he was caught trying to sneak into ISIS territory had revealed during questioning that at least six persons from the state have joined ranks in Syria the official said A senior officer said the video presents a rare strategy of IS where instead of taking pride in their brutal actions as earlier they are employing a positive PR campaign to tout their medical successes But make no mistake They still thrive on hatred for un Islamic administrations the official said The video also focuses on civilian victims of the air strikes and the heroics of Raqqa s fighters According to information available with Indian authorities till last year 21 men women and children from Kerala left for Afghanistan via Iran to live in the IS controlled territory Some of them are learnt to have been killed in drone attacks
22200,False,,,,,,,india,2017,The Governments of Odisha and West Bengal will soon organize a joint security exercise named as Sagar Kavach to further tighten the existing coastal security mechanism along the 630 km long coastline reports The Times of India on November 10 This was informed by Odisha s additional chief secretary Home department Asit Tripathy after attending a meeting in Bhubaneswar Sagar Kavach security exercise is a realistic drill to check the efficacy of the security parameters and preparedness of various security forces like the Indian Navy Marine Police force Indian Coast Guard ICG Forest Department Fisheries and district administration Tripathy said Stating that Odisha for the first time will have a joint security drill along with West Bengal Tripathy said We are going to organise a simulated terror attack named red force at a random place along Odisha or West Bengal coast and check how effective our marine policing is The exercise will be held over two days within a week he said The participants in the drill will be personnel from the Indian Navy Coast Guard at Paradip and Haldia 18 marine Police stations in Odisha and 12 Police stations of West Bengal
23998,False,,,,,,,nepal,2017,Netra Bikram Chandled Communist Party of NepalMaoist CPNMaoist has intensified its extortion drive from businesspersons and institutions both within Kathmandu Valley and beyond creating terror among them reports Republica on February 15 Businesspersons who were subjected to demands for hefty donations complained that the amounts demanded by the Maoists range from a few hundred thousand rupees to millions We are living under constant fear of the possible eventualities as we are not in a position to pay such hefty amounts in the name of donations ” said one businessperson on condition of anonymity Not just businessperson the Chandled Maoists have extended their extortion drive to various institutions also A group of party cadres recently visited the office of the Pashupati Area Development Trust PADT and demanded money from Member Secretary Govinda Tandon as donation “They came to me and said the PADT must provide money to the party ” Tandon said adding that they did not mention any specific amount
23539,False,,,,,,,pakistan,2017,Federal Minister of Interior Ahsan Iqbal told the Senate Upper House of National Assembly on September 14 that it was the responsibility of the Provincial Governments to keep an eye out for and take action against banned outfits in the country including those organisations that were resurfacing under new names after being outlawed reports Dawn The Senate had asked Minister Iqbal to provide the name of the authority or agency responsible for keeping a lookout for banned organisations in the country under the National Action Plan and the role of the Ministry of Interior in monitoring the activities of these organisations In a written reply sent to the Senate Minister Iqbal said “It is the responsibility and authority of the provincial governments to take action in each case under the law Intelligence agencies are mandated to keep regular watch on the activities of proscribed organisations The Ministry of Interior regularly receives reports from intelligence agencies on the activities of proscribed organisations and shares the same with the NACTA and the provincial governments ”
19822,False,,,,,,,india,2017,In another ceasefire violation Pakistan army resorted to heavy shelling and firing in Balakote sector of Mendhar tehsil revenue unit in Poonch District in wee hours of May 17 morning reports Daily Excelsior Official sources said that since the migration from villages located close to LoC in Nowshera sector in Rajouri District continued even though there was no major incident of Pakistani shelling and firing today the administration has increased number of make shift migrant camps from four to five However on May 16 evening Pakistani troops had targeted Pukharni and surrounding villages in Nowshera sector in Rajouri District by resorting to mortar shelling and firing for over two hours adds Daily Excelsior
20082,False,,,,,,,india,2017,Assam Rifles AR arrested Timsay Pongner a ‘worker ‘of the Nationalist Socialist Council of Nagaland Isak Muivah NSCN IM from Ledo town in Tinsukia District in the night of May 31 reports The Telegraph
19181,False,,,,,,,india,2017,Two of the three men arrested from Madhya Pradesh within hours of an explosion on board the Bhopal Ujjain passenger train on March 7 have told the National Investigation Agency NIA that their original target was not this train but the Lucknow Bhopal Pushpak Express on which they travelled the previous night Indian Express reports on March 28 Atif Muzaffar and Syed Mir Husain told the NIA that they travelled in the Pushpak Express on March 6 with an explosives filled bag but could not plant it because of the “heavy rush” and “alert passengers” Official sources said Atif bought three tickets for the Pushpak Express but throughout the journey they could not find a suitable spot or the right time to plant the bomb They got off at Bhopal railway station on March 7 morning where Atif and Danish made a last minute decision to place the bomb on the passenger train that was waiting to leave for Ujjain “After their failure to plant the bomb on the Pushpak Express they got desperate They managed to get into the last coach of the Bhopal Ujjain train that was about to leave the station left the bag filled with explosives and got off” sources said The explosion left 10 persons injured From the question of the arrested men the NIA has learnt that the four Saifullah included met each other in December 2015 and two months later in February 2016 they decided to form a group in the name of jihad “They rented a room in Lucknow where they gave themselves “code” names — Jiya Abu Ibrahim for Atif Jafar Abu Ismail for Danish Ali Abu Makaiel for Saifullah and Hamza Abu Waqas for Husain ” sources said Syed Mir Husain told his interrogators that they used the code names while interacting with each other and also with the intention of hiding their original identities “Saifullah had even made a fake ID card in the name of Ali ” sources said For one year from February 2016 to February 2017 the four travelled across the country hoping to cross over into Pakistan from Jammu Kashmir Punjab and Rajasthan or into Bangladesh but found it was not as simple as they had imagined They also went to Kozhikode in Kerala to explore ways of “migrating to the Caliphate” While they did not meet with much success they met several persons who they thought could help them establish contact with the Islamic State IS sources said In July 2016 during Ramzan Atif became the ameer chief of the group and the four took the oath of allegiance to the Islamic State
22377,True,"['SF personnel', 'tractor']",['CPI Maoist'],"['Improvised Explosive Devices', 'IEDs', 'IEDs', 'ablaze']","['Bombing/Explosion', 'Bombing/Explosion', 'Bombing/Explosion', 'Facility/Infrastructure Attack']","['Budha Pahad', 'Latehar']",['November 23'],india,2017,Meanwhile 30 Improvised Explosive Devices IEDs seized from Budha Pahad in Latehar District were defused by the Bomb Disposal Squad BDS on November 23 reports New Indian Express The IEDs planted in series were seized by the SF personnel soon after the suspected CPI Maoist cadres set ablaze a tractor in Mounasilli under Palamau Tiger project in Baresaad Police station limit the sources said The Maoists have also stopped the construction work of a watch tower being set up by the forest department amidst ongoing anti Maoist operation they said
22107,False,,,,,,,india,2017,The Police arrested two Communist Party of India Maoist CPI Maoist cadres identified as Kartam Hunga and Podiya Masa are experts in bomb making within Awapalli Police Station limits in Bijapur District on November 2 reports The Hindu The Bijapur Police in a press statement said “The Additional Superintendent of Police Bijapur Mohit Garg led a joint team of the District Reserve Group DRG and the Commando Battalion for Resolute Action CoBRA in an anti Maoist operation in Hamrah Murduda Vayguda and Chatalpalli areas of Bijapur When the team was returning through Chatalpalli forest road two youths were seen digging the road ” The members of the team found the behaviour of the youths suspicious When the Security Forces SFs approached the youths they ran away The team then cordoned off the area and arrested both of them The statement said “One of them was carrying a tiffin bomb and a long wire A nylon rope pressure mechanism and electric wire were recovered from them along with batteries ” The statement added “Both of them confessed that they were planting bombs to target the police parties They were produced before a court in Bijapur on Thursday
23925,False,,,,,,,nepal,2017,Human Rights Watch HRW has said Nepal failed to ensure accountability for human rights abuses during the decade long Maoist war reports The Himalayan Times on January 13 “Nepal made little concrete progress on justice for serious abuses committed by both sides during its civil war that ended in 2006 ” the report said adding that efforts to ensure prosecutions in civilian courts for serious human rights and humanitarian law violations during the conflict remain stalled It further claimed that efforts to enforce rights or provide justice for wartime abuses were stalled due to violent protests in the Tarai in the wake of promulgation of the new constitution in September 2015
24146,False,,,,,,,nepal,2017,Communist Party of Nepal Unified Marxist Leninist CPN UML Chairman KP Sharma Oli addressing a function in Kathmandu on April 7 accused the Madhesi parties of confusing people by raising “unnecessary agendas” reports The Himalayan Times He said “Instead of holding elections at three tiers to take the nation out of transition The Madhes centric parties have been raising unnecessary issues and confusing people Now we should not commit mistakes as in the past We should accelerate the pace to build the nation ”
20982,False,,,,,,,india,2017,Syria s Ambassador to India Riad Kamel Abbas on July 31 said his country has no information about the 39 Indians who went missing in Iraq in 2014 reports news18 com He however said Syria is keen to send them home if they are found in its territory The Indian delegation went to Syria many times and the chief of Syrian intelligence agency came to Delhi for it the envoy said We are very keen to bring them missing Indians home if they are in our territory but there is no official confirmation about it he added
19013,False,,,,,,,india,2017,In an address to a conference via video conferencing from Raipur District on ‘’Counter Terrorism’’ in New Delhi Chief Minister CM Raman Singh on March 15 said that effective and good governance will spell the death knell of Naxalism Left Wing Extremism LWE and terrorism reports The Pioneer He added that LWE had been brought to an end in Surguja division The authorities are working on the socio economic front in Bastar division and the results will be known soon Further he told that the LWE had destroyed education health roads and communications links in the far flung regions of Bastar division He also elaborated that medical services are being expanded in Bijapur District under the new innovative model Five Prayas Residential schools had been opened in Raipur Bilaspur Ambikapur Surguja Jagdalpur Bastar and Durg Divisions to cater to the educational needs of children in the Naxalites’ violence affected Districts He also informed that additional funds of INR 2 billion for Dantewada and INR 4 billion for Korba had been allocated under the Prime Minister Narendra Modi’s District Mineral Foundation Project DMFP It had created a positive environment in the regions
18783,True,,"['Communist Party of India Maoist', 'CPI Maoist', 'militia commander']","['died', 'injuries', 'pressure bomb']","['Bombing/Explosion', 'Bombing/Explosion', 'Bombing/Explosion']",['East Godavari'],['February 27'],india,2017,A Communist Party of India Maoist CPI Maoist cadre identified as Kotesu died on the spot and a Sabari Committee ‘militia commander’ Kaaki Kannayya suffered serious injuries while planting pressure bomb in East Godavari District on February 27 reports New Indian Express The spot where the incident took place was near National Highway 30
21201,False,,,,,,,india,2017,Altogether 68 militants of six different militant groups laid down arms before the Government at a ceremony held at 1st Battalion Manipur Rifles banquet hall on August 15 reports Epao The militants who laid down arms today included 17 of United National Liberation Front UNLF 23 of Kangleipak Communist Party KCP seven of People’s Liberation Army PLA 10 of People’s Revolutionary Party of Kangleipak PREPAK four of Kanglei Yowel Kanna Lup KYKL and seven of Progressive faction of PREPAK PREPAK PRO However only seven eight weapons reportedly brought by the militants were displayed at the ceremony saying that other weapons were being verified by Police Speaking at the home coming ceremony Chief Minister N Biren assured that all the militants who have joined the mainstream would be fully protected
23659,False,,,,,,,pakistan,2017,The Attorney General for Pakistan Ashtar Ausaf Ali on November 1 presented ‘sensitive’ documents before a judge of the Lahore High Court in his chamber to defend detention of Jama’at ud Dawa JuD chief Hafiz Muhammad Saeed reports The Dawn Earlier the AGP told the judge that the documentary material relied upon by the Federal Government to detain Hafiz Saeed was sensitive in nature and would not be appropriate to present in open court He sought permission from the court to produce the relevant material in chamber and also requested it not to place the same on record of the case After Justice Syed Mazahar Ali Akbar Naqvi allowed the request the AGP shared the documents with the judge in his chamber where Advocate Dogar was also present
23199,False,,,,,,,pakistan,2017,A journalism student was lynched at Abdul Wali Khan University AWKU in Mardan District of Khyber Pakhtunkhwa in broad daylight on April 13 after being accused of blasphemy reports The Express Tribune The deceased was identified as Mashal Khan a resident of Swabi and a student at AWKU’s Journalism and Mass Communication department A friend of the deceased student said that a mob attacked him before shooting him in the head and chest He added that the mob then continued to beat his body with sticks
23182,False,,,,,,,pakistan,2017,Separately a high value terrorist Mehmoodul Hassan alias Khwaja Madni and his accomplice from the TTP’ Sajna group were killed in an operation by Security Forces SFs in Jandola area of South Waziristan Agency on March 31 Dawn reported quoting the Inter Services Public Relations ISPR statement The SFs personnel recovered weapons and ammunitions from the terrorists hideout
17809,False,,,,,,,bangladesh,2017,The Statue of the Lady Justice which was taken down on May 26 was reinstalled on May 27 in front of the Supreme Court SC s annex building reports The Daily Star Sculptor Mrinal Haque told that he considered the new home of the sculpture not a home at all since people would hardly notice it now He said the previous location was the best place for the sculpture but he was happy that it at least has finally found a home
17664,False,,,,,,,bangladesh,2017,Inspector General of Police IGP AKM Shahidul Hoque on March 18 said that extremists and terrorists to be eliminated with iron hand reports New Age He said “We have already identified masterminds of extremists and their networks alongside the neo JMB Jamaatul Mujahideen Bangladesh The law enforcement agencies are working to arrest militants and their close associates ”
18717,False,,,,,,,india,2017,The government on February 21 decided not to support a Private Member s Bill which seeks to declare Pakistan a country sponsoring terrorism reports indiatvnews com India can t declare any country a Terror State as it has to maintain diplomatic relations with all countries Besides in principle it is very rare that government supports any Private Member s Bill an official of Union MInistry of Home Affairs UMHA said The Declaration of Countries as Sponsor of Terrorism Bill 2016 moved by Independent member Rajeev Chandrasekhar in Rajya Sabha Upper House of Indian Parliament seeks to call out states like Pakistan that continue to associate promote patronise and sponsor terrorism against our nation and provides for snapping all economic and trade relations with that country The UMHA has conveyed to the Rajya Sabha Secretariat about its opposition to the Bill saying such a move may ‘jeopardise’ international relations
